鳳山區,租賃房屋,高雄市鳳山區和德街１５７號９樓,0.0,,,,1120903,土地0建物1車位0,九層,23,住宅大樓(11層含以上有電梯),集合住宅,鋼筋混凝土,1091210,107.87,1,1,1,有,有,有,15000,139,,0.0,0,面積含車位面積但無出租,RPUNMLRJRHIGFGE76CC,整棟(戶)出租,有,1120915~1130914,有,冷氣、熱水器、洗衣機、冰箱、瓦斯或天然氣、有線電視,社會住宅代管
鳥松區,租賃房屋,高雄市鳥松區松埔北巷２之１０４號十二樓,0.0,,,,1120901,土地0建物1車位0,十二層,15,住宅大樓(11層含以上有電梯),住家用,鋼筋混凝土造,0860204,64.86,1,1,1,有,有,有,6500,100,,0.0,0,高雄市社會住宅包租代管計畫,RPTNMLRJRHIGFIE86CC,整棟(戶)出租,有,1120910~1130624,有,冷氣、熱水器、洗衣機、電視機、冰箱,社會住宅包租轉租
仁武區,租賃房屋,高雄市仁武區八德中路２３５號１樓,88.3,住,,,1120905,土地2建物1車位0,一層,4,店面(店鋪),住宅,鋼筋混凝土,1110609,45.64,0,0,0,無,無,無,30000,657,,0.0,0,租賃期間有約定不同租金民國112年9月5日至112年9月17日裝潢搬遷期優惠租金新台幣零元整民國112年9月18日至112年9月30日每日租金新台幣壹仟元，共計新台幣壹萬參仟元整民國112年10月1日至113年9月30日每月租金新台幣參萬元整；,RPXNMLRJRHIGFIE27CC,,無,1120918~1130930,無,,
鳥松區,租賃房屋,高雄市鳥松區大埤路２９之６１號３樓,0.0,,,,1120905,土地0建物1車位0,三層,12,住宅大樓(11層含以上有電梯),住家用,鋼筋混凝土造,0700116,43.13,1,0,1,有,有,有,6500,151,,0.0,0,,RPQOMLRJRHIGFIE66CC,獨立套房,有,1120914~1130913,有,冷氣、熱水器,社會住宅包租轉租
鼓山區,租賃房屋,高雄市鼓山區華安街６３號,80.0,住,,,1120817,土地1建物1車位0,全,5,透天厝,住商用,鋼筋混凝土造,0950525,207.31,6,2,4,有,無,無,35000,169,,0.0,0,,RPTNMLRJRHIGFAE78DC,,無,1121001~1150930,無,,
前金區,租賃房屋,高雄市前金區大同一路２９０號五樓,0.0,,,,1120825,土地0建物1車位0,五層,28,住宅大樓(11層含以上有電梯),集合住宅,鋼骨構造、鋼骨鋼筋混凝土構造、鋼筋混凝土造,1070904,65.05000000000001,2,1,1,有,有,有,15000,231,,0.0,0,續租案件；,RPQNMLSJRHIGFAE48CC,整棟(戶)出租,有,1120825~1130824,有,冷氣、熱水器、洗衣機、電視機、冰箱,
鹽埕區,租賃房屋,高雄市鹽埕區七賢三路２６９號１３樓之３,0.0,,,,1120905,土地0建物1車位0,十三層,16,住宅大樓(11層含以上有電梯),,鋼筋混凝土造,0750217,39.4,1,0,1,有,有,有,5000,127,,0.0,0,,RPRNMLSJRHIGFAE58CC,整棟(戶)出租,有,1120908~1130907,有,冷氣、熱水器、冰箱,社會住宅包租轉租
鼓山區,租賃房屋,高雄市鼓山區河西一路１４４７號十四樓,0.0,,,,1120830,土地0建物1車位0,十四層,15,住宅大樓(11層含以上有電梯),住家用,鋼筋混凝土造,0960510,81.95,2,2,1,有,有,有,13513,165,,0.0,0,此為住宅及都市更新中心社會住宅包租代管計畫之物件管理費1487元,RPSNMLSJRHIGFAE68CC,整棟(戶)出租,有,1120831~1130830,有,冷氣、熱水器、洗衣機、電視機、冰箱、瓦斯或天然氣,社會住宅代管
新興區,租賃房屋,高雄市新興區文橫二路１６９號,0.0,,,,1120823,土地0建物1車位0,見其他登記事項,3,店面(店鋪),住商用,加強磚造,0550509,125.14,0,0,0,無,無,無,40000,320,,0.0,0,租金總額含稅；其他二代健保補充保費；,RPUNMLSJRHIGFBE98CC,,無,1121001~1170930,無,,
苓雅區,租賃房屋,高雄市苓雅區和平一路６２巷２３之１號,0.0,,,,1120908,土地0建物1車位0,二層,4,公寓(5樓含以下無電梯),,鋼筋混凝土造,0640114,73.96,2,1,2,有,無,有,14500,196,,0.0,0,,RPVNMLSJRHIGFBE09CC,整棟(戶)出租,無,1120905~1130904,無,冷氣、熱水器、洗衣機、冰箱,社會住宅包租轉租
苓雅區,租賃房屋,高雄市苓雅區尚義街１１１號４樓之４,0.0,,,,1120831,土地0建物0車位0,四層,12,住宅大樓(11層含以上有電梯),,鋼筋混凝土造,0751128,21.49,4,2,3,有,有,有,7800,363,,0.0,0,租金總額含管理費；水費；網路費；租賃建物部分範圍，且未計入共有部分面積；,RPWNMLSJRHIGFBE56CC,分租套房,有,1120901~1130229,有,冷氣、熱水器、電視機、冰箱、有線電視,
新興區,租賃房屋,高雄市新興區中山一路２６３號五樓之８,0.0,,,,1120906,土地0建物1車位0,五層,12,住宅大樓(11層含以上有電梯),,鋼筋混凝土造,0721227,53.260000000000005,1,0,1,有,有,有,10000,188,,0.0,0,續租案件；,RPXNMLSJRHIGFBE66CC,整棟(戶)出租,有,1120910~1130909,有,冷氣、熱水器、洗衣機、電視機、冰箱,社會住宅代管
新興區,租賃房屋,高雄市新興區七賢二路５５號八樓之１,0.0,,,,1120828,土地0建物1車位0,八層,15,住宅大樓(11層含以上有電梯),住家用,鋼筋混凝土造,1060424,174.84,2,1,1,有,有,有,26000,149,,0.0,0,未租賃車位，建物登記含有車位面積；,RPOOMLSJRHIGFBE48CC,整棟(戶)出租,有,1120901~1130831,有,冷氣、熱水器、洗衣機、電視機、冰箱,
小港區,房地(土地+建物),高雄市小港區高坪１１路３９６巷５６號５樓,21.86,住,,,1120822,土地1建物1車位0,五層,5,公寓(5樓含以下無電梯),集合住宅,鋼筋混凝土,1090428,59.69,2,1,1,有,有,有,12000,201,,0.0,0,續租。；,RPRNMLQLQHIGFCE68CC,,,,,,
前鎮區,租賃房屋,高雄市前鎮區復興三路１４８號五樓之１１,0.0,,,,1120905,土地0建物1車位0,五層,7,華廈(10層含以下有電梯),住家用,鋼筋混凝土造,0791130,40.71,1,0,1,有,有,有,6500,160,,0.0,0,此為住宅及都市更新中心社會住宅包租代管計畫之物件管理費1000元,RPVNMLSJRHIGFCE56CC,整棟(戶)出租,有,1120905~1130904,有,冷氣、熱水器、洗衣機、電視機、冰箱,社會住宅代管
前鎮區,租賃房屋,高雄市前鎮區草衙一路３６巷３１號,0.0,,,,1120825,土地0建物1車位0,全,1,透天厝,住家用,磚造浪板,0570601,53.8,2,1,1,有,無,無,4300,80,,0.0,0,此為住宅及都市更新中心社會住宅包租代管計畫之物件,RPXNMLSJRHIGFCE76CC,整棟(戶)出租,無,1120828~1130827,無,冷氣、熱水器、洗衣機,社會住宅代管
前鎮區,租賃房屋,高雄市前鎮區光華三路１８５號十二樓之１,0.0,,,,1120830,土地0建物1車位0,十二層,15,住宅大樓(11層含以上有電梯),住家用,鋼筋混凝土造,0950614,116.5,3,2,2,有,有,有,22978,197,,0.0,0,此為住宅及都市更新中心社會住宅包租代管計畫之物件管理費2022元,RPOOMLSJRHIGFCE58CC,整棟(戶)出租,有,1120915~1130914,有,冷氣、熱水器、洗衣機、電視機、冰箱、瓦斯或天然氣,社會住宅代管
前鎮區,租賃房屋,高雄市前鎮區港壽街３２５號,94.0,住,,,1120823,土地1建物1車位0,全,4,透天厝,住商用,鋼筋混凝土造,0930311,72.24,4,3,4,有,無,有,28000,388,,0.0,0,,RPPOMLSJRHIGFCE68CC,整棟(戶)出租,無,1120901~1130831,無,冷氣、熱水器、洗衣機、冰箱、瓦斯或天然氣,
小港區,租賃房屋,高雄市小港區店北路１９２號１５樓,0.0,,,,1120831,土地0建物1車位0,十五層,16,住宅大樓(11層含以上有電梯),住家用,鋼筋混凝土造,0801224,140.09,4,1,2,有,有,有,10000,71,,0.0,0,,RPQOMLSJRHIGFCE78CC,整棟(戶)出租,有,1120901~1130831,有,冷氣、熱水器、洗衣機、冰箱、有線電視,社會住宅代管
前鎮區,租賃房屋,高雄市前鎮區衙東街２３號三樓,0.0,,,,1120905,土地0建物1車位0,三層,10,華廈(10層含以下有電梯),集合住宅,鋼筋混凝土造,1120131,62.650000000000006,2,2,1,有,有,有,14500,231,,0.0,0,此為住宅及都市更新中心社會住宅包租代管計畫之物件管理費1500元,RPROMLSJRHIGFCE88CC,整棟(戶)出租,有,1120910~1130909,有,冷氣、熱水器、洗衣機、冰箱、瓦斯或天然氣,社會住宅包租轉租
三民區,租賃房屋,高雄市三民區察哈爾二街３９號３樓之７,0.0,,,,1120907,土地0建物1車位0,三層,14,住宅大樓(11層含以上有電梯),集合住宅,鋼筋混凝土,1110304,80.03,2,1,1,有,有,無,19800,247,,0.0,0,,RPPNMLSJRHIGFDE68CC,整棟(戶)出租,有,1120906~1130905,有,電視機,一般包租
三民區,租賃房屋,高雄市三民區大裕路１７４巷３０號十三樓,0.0,,,,1120830,土地0建物1車位0,十三層,14,住宅大樓(11層含以上有電梯),住家用,鋼筋混凝土造,0871102,110.96000000000001,2,1,2,有,有,有,19800,178,,0.0,0,此為住宅及都市更新中心社會住宅包租代管計畫之物件,RPUNMLSJRHIGFDE56CC,整棟(戶)出租,有,1120830~1130829,有,熱水器、洗衣機、冰箱、瓦斯或天然氣,社會住宅代管
三民區,租賃房屋,高雄市三民區義和路６２巷６號七樓,0.0,,,,1120907,土地0建物1車位0,七層,9,華廈(10層含以下有電梯),住家用,鋼筋混凝土造,0881103,70.09,2,2,1,有,有,有,14500,207,,0.0,0,,RPVNMLSJRHIGFDE66CC,整棟(戶)出租,有,1120910~1130909,有,冷氣、熱水器、洗衣機、電視機、冰箱、瓦斯或天然氣,一般代管
三民區,租賃房屋,高雄市三民區力行路２４０號,112.0,住,,,1120905,土地1建物1車位0,一層,2,店面(店鋪),住家用,加強磚造,0521209,47.89,1,1,2,有,無,無,23000,480,,0.0,0,因為只租一樓前半部及騎樓謄本無單獨開始的坪數所以只能量丈尺寸換算騎樓深3.925公尺X寬5.5公尺=21.58平方公尺一樓深5.68公尺X寬4.633公尺=26.31平方公尺不含衛浴所以出租的建坪約47.89平方公尺,RPWNMLSJRHIGFDE76CC,,無,1121015~1151014,無,,
三民區,租賃房屋,高雄市三民區褒揚街１４７巷１號４樓,23.46,商,,,1120907,土地1建物1車位0,四層,5,公寓(5樓含以下無電梯),,鋼筋混凝土造,0751104,94.33,3,2,2,有,無,無,14000,148,,0.0,0,,RPXNMLSJRHIGFDE86CC,整棟(戶)出租,無,1120916~1130915,無,,
左營區,土地,福民段223地號,327.83,住,,,1120901,土地1建物0車位0,,,其他,,,,0.0,0,0,0,無,無,無,30000,92,,0.0,0,,RPQNMLSJRHIGFEE88CC,,,1120901~1171130,,,
楠梓區,租賃房屋,高雄市楠梓區加昌路７９號六樓之５,0.0,,,,1120830,土地0建物1車位0,六層,15,住宅大樓(11層含以上有電梯),集合住宅,鋼筋混凝土,1041112,85.74,2,1,1,有,有,有,17000,198,,0.0,0,此為住宅及都市更新中心社會住宅包租代管計畫之物件,RPRNMLSJRHIGFEE98CC,整棟(戶)出租,有,1120830~1130829,有,冷氣、熱水器、洗衣機、電視機、冰箱、瓦斯或天然氣,社會住宅代管
楠梓區,租賃房屋+車位,高雄市楠梓區朝明路１１６巷５５號五樓,0.0,,,,1120908,土地0建物1車位1,五層,15,住宅大樓(11層含以上有電梯),集合住宅,鋼筋混凝土,1060123,129.4,3,2,2,有,有,有,15000,116,坡道平面,29.28,0,,RPSNMLSJRHIGFEE09CC,整棟(戶)出租,有,1120904~1130903,有,冷氣、熱水器、洗衣機、冰箱,社會住宅代管
左營區,租賃房屋,高雄市左營區文德路３１號１０樓之３,9.96,住,,,1120907,土地1建物1車位0,十層,13,住宅大樓(11層含以上有電梯),住家用,見使用執照,0920820,77.61,2,1,1,有,有,有,17000,219,,0.0,0,,RPTNMLSJRHIGFEE56CC,整棟(戶)出租,有,1120910~1130910,有,冷氣、熱水器、洗衣機、電視機、冰箱、瓦斯或天然氣,
鳳山區,租賃房屋+車位,高雄市鳳山區海涵路３５２號,16.71,住,,,1120815,土地1建物1車位1,一層,14,住宅大樓(11層含以上有電梯),店舖,鋼筋混凝土,1110118,101.61,0,0,0,無,有,無,26000,256,坡道平面,18.39,0,,RPPNMLSJRHIGFGE98CC,,有,1121005~1141005,有,,
鳥松區,土地,長庚段114地號,2631.0,農,,,1120903,土地1建物0車位0,,,其他,,,,0.0,0,0,0,無,無,無,60000,23,,0.0,0,地上含有未保存登記廠房12/20日申報更正 原申報書序為:C1EI11209080001,RPPNMLSJRHIGFIE56CC,,,1121101~1161030,,,
大社區,土地,保社段10地號,211.9,工,,,1120831,土地1建物0車位0,,,其他,,,,0.0,0,0,0,無,無,無,18000,85,,0.0,0,含增建或未登記建物。土地租賃部份。建物門牌：高雄市大社區旗楠路68-6號,RPQNMLSJRHIGFIE66CC,,,1120901~1130831,,,
大社區,租賃房屋,高雄市大社區中華路８９巷３２號,0.0,,,,1120828,土地0建物0車位0,全,4,透天厝,集合住宅,鋼筋混凝土,1070606,26.08,19,0,19,有,無,有,5500,211,,0.0,0,此為分租套房，第二層共分成5間，一間面積約為26.08平方公尺。,RPRNMLSJRHIGFIE76CC,分租套房,無,1120828~1130227,無,冷氣、熱水器、洗衣機、冰箱,一般代管
仁武區,土地,綠園段1039地號,138.84,,一般農業區,農牧用地,1120816,土地1建物0車位0,,,其他,,,,0.0,0,0,0,無,無,無,23000,166,,0.0,0,承租土地約42坪，承租未保存登記建物約30坪含增建或未登記建物；,RPSNMLSJRHIGFIE86CC,,,1120824~1130823,,,
仁武區,租賃房屋,高雄市仁武區安樂一街３５５巷１弄９號,0.0,,,,1120901,土地0建物1車位0,全,4,透天厝,住家用,鋼筋混凝土造,0831229,186.26,4,2,3,有,無,有,21000,113,,0.0,0,,RPTNMLSJRHIGFIE96CC,整棟(戶)出租,無,1120908~1130907,無,熱水器,
大寮區,土地,磚子段3851地號,230.0,農,,,1120817,土地1建物0車位0,,,其他,,,,0.0,0,0,0,無,無,無,30000,130,,0.0,0,承租未保存登記建物約60坪。,RPPNMLSJRHIGFLE86CC,,,1120901~1130831,,,
苓雅區,車位,高雄市苓雅區新光路４８號等公共設施B１-００１車位,0.0,,,,1120905,土地0建物0車位1,,,其他,,,,14.65,0,0,0,無,無,無,3000,,坡道平面,14.65,3000,,RPPNMLTJRHIGFBE58CC,,,1120905~1130904,,,
新興區,租賃房屋,高雄市新興區自立二路９８號１２樓,12.94,商,,,1120908,土地1建物1車位0,十二層,15,住宅大樓(11層含以上有電梯),住家用,鋼筋混凝土造,1050617,146.0,3,2,2,有,有,有,46000,315,,0.0,0,租金總額含管理費；水費；電費；瓦斯費；網路費；其他第四台；,RPQNMLTJRHIGFBE68CC,整棟(戶)出租,有,1120915~1121214,有,冷氣、熱水器、洗衣機、電視機、冰箱、瓦斯或天然氣、有線電視、網路,一般代管
鼓山區,租賃房屋,高雄市鼓山區九如四路７４２巷２１弄６號,0.0,,,,1120831,土地0建物1車位0,全,2,透天厝,,加強磚造,0671110,74.4,5,2,4,有,無,無,10000,134,,0.0,0,,RPQNMLLKRHIGFAE87CC,整棟(戶)出租,無,1120901~1130831,無,冷氣、熱水器、洗衣機、電視機、冰箱、瓦斯或天然氣,一般代管
鼓山區,租賃房屋,高雄市鼓山區昌盛路２８９號２樓,11.98,商,,,1120814,土地1建物1車位0,二層,8,華廈(10層含以下有電梯),住家用,鋼筋混凝土造,0780605,140.46,3,2,2,有,有,有,21000,150,,0.0,0,,RPSNMLLKRHIGFAE08CC,整棟(戶)出租,有,1120814~1130813,有,冷氣、熱水器、電視機、瓦斯或天然氣,一般轉租
鼓山區,租賃房屋,高雄市鼓山區雄峰路１號八樓之１,0.0,,,,1120818,土地0建物1車位0,八層,11,住宅大樓(11層含以上有電梯),住家用,鋼筋混凝土造,0710818,82.63,3,2,1,有,有,無,5000,61,,0.0,0,,RPTNMLLKRHIGFAE18CC,整棟(戶)出租,有,1120901~1130831,有,冷氣、熱水器、洗衣機、電視機、冰箱、瓦斯或天然氣,一般代管
鼓山區,租賃房屋,高雄市鼓山區鼓山一路１６１巷５０弄２６９號三樓之１,0.0,住,,,1120830,土地1建物1車位0,三層,5,公寓(5樓含以下無電梯),住家用,鋼筋混凝土造,0720321,80.13999999999999,3,2,1,有,無,無,10000,125,,0.0,0,,RPUNMLLKRHIGFAE28CC,整棟(戶)出租,無,1120901~1130831,無,冷氣、熱水器、洗衣機、冰箱、瓦斯或天然氣,一般代管
鼓山區,租賃房屋,高雄市鼓山區瑞豐街３號四樓之２,0.0,住,,,1120831,土地1建物1車位0,四層,5,公寓(5樓含以下無電梯),,鋼筋混凝土造,0700620,72.34,3,2,1,有,無,無,7000,97,,0.0,0,,RPVNMLLKRHIGFAE38CC,整棟(戶)出租,無,1120906~1130905,無,冷氣、熱水器、瓦斯或天然氣,一般代管
鼓山區,租賃房屋,高雄市鼓山區翠華路６３巷３５號五樓,0.0,,,,1120901,土地0建物1車位0,五層,15,住宅大樓(11層含以上有電梯),住家用,鋼筋混凝土造,0970507,89.41,2,1,1,有,有,有,11650,130,,0.0,0,管理費1350元,RPWNMLLKRHIGFAE48CC,整棟(戶)出租,有,1120901~1130831,有,冷氣、熱水器、洗衣機、電視機、冰箱、瓦斯或天然氣,社會住宅代管
前金區,租賃房屋,高雄市前金區光明街２號７樓之５,0.0,,,,1120901,土地0建物1車位0,七層,15,住宅大樓(11層含以上有電梯),集合住宅,鋼筋混凝土,1080715,84.1,2,2,1,有,有,有,24000,285,,0.0,0,租金總額含管理費；,RPXNMLLKRHIGFAE58CC,整棟(戶)出租,有,1120904~1130903,有,冷氣、熱水器、洗衣機、電視機、冰箱、瓦斯或天然氣,
前金區,租賃房屋,高雄市前金區大同一路２７６號二十五樓,0.0,,,,1120814,土地0建物1車位0,二十五層,28,住宅大樓(11層含以上有電梯),集合住宅,鋼骨構造、鋼骨鋼筋混凝土構造、鋼筋混凝土造,1070904,103.56,2,2,1,有,有,有,34000,328,,0.0,0,租金總額含管理費；未租賃車位，建物登記含有車位面積；,RPOOMLLKRHIGFAE77CC,整棟(戶)出租,有,1120815~1130814,有,冷氣、熱水器、洗衣機、電視機、冰箱,
前金區,租賃房屋,高雄市前金區中華三路１０５號三樓,0.0,,,,1120814,土地0建物1車位0,三層,15,住宅大樓(11層含以上有電梯),住家用,鋼筋混凝土造,1040703,88.78999999999999,2,2,1,有,有,有,34000,383,,0.0,0,租金總額含管理費；其他房屋之稅捐、租賃所得稅、二代健保補充費；,RPPOMLLKRHIGFAE87CC,整棟(戶)出租,有,1120815~1130814,有,冷氣、熱水器、洗衣機、電視機、冰箱、瓦斯或天然氣,
苓雅區,租賃房屋,高雄市苓雅區復興二路２０號八樓之１１,0.0,,,,1120831,土地0建物1車位0,八層,16,住宅大樓(11層含以上有電梯),住家用,鋼筋混凝土造,0850920,33.9,1,0,1,有,有,有,8000,236,,0.0,0,續租案件；,RPPNMLLKRHIGFBE87CC,整棟(戶)出租,有,1120701~1130630,有,冷氣、熱水器、洗衣機、電視機、冰箱,社會住宅代管
苓雅區,租賃房屋,高雄市苓雅區民權一路３４號１６樓,70.4,住,,,1120908,土地1建物1車位0,十六層,23,住宅大樓(11層含以上有電梯),,鋼筋混凝土造,0721029,147.06,4,1,2,有,有,無,17000,116,,0.0,0,,RPQNMLLKRHIGFBE97CC,,有,1120923~1130922,有,冷氣,
新興區,租賃房屋,高雄市新興區中山一路２６３號十二樓之八,0.0,,,,1120905,土地0建物1車位0,十二層,12,住宅大樓(11層含以上有電梯),,鋼筋混凝土造,0721227,52.66,1,0,1,有,有,有,8000,152,,0.0,0,續租案件；,RPRNMLLKRHIGFBE08CC,整棟(戶)出租,有,1120815~1130814,有,冷氣、熱水器、洗衣機、電視機、冰箱,社會住宅代管
新興區,租賃房屋,高雄市新興區民主路２６號６樓之４,0.0,,,,1120816,土地0建物1車位0,六層,7,華廈(10層含以下有電梯),住家用,鋼筋混凝土造,0801126,40.6,1,0,1,有,無,有,8000,197,,0.0,0,此為高雄市政府社會住宅包租代管計畫之物件。,RPSNMLLKRHIGFBE18CC,整棟(戶)出租,無,1120816~1130815,有,冷氣、熱水器、洗衣機、電視機、冰箱,社會住宅代管
苓雅區,租賃房屋,高雄市苓雅區新光路６２巷１７號１９樓之２,5.16,商,,,1120905,土地1建物1車位0,十九層,35,住宅大樓(11層含以上有電梯),住家用,鋼筋混凝土造,0860421,126.6,3,2,2,有,有,有,15000,118,,0.0,0,租金總額含管理費；未租賃車位，建物登記含有車位面積；,RPVNMLLKRHIGFBE48CC,整棟(戶)出租,有,1120916~1130915,有,冷氣、熱水器、洗衣機、電視機、瓦斯或天然氣,
新興區,租賃房屋,高雄市新興區中山一路２６３號７樓之１０,0.0,,,,1120824,土地0建物1車位0,七層,12,住宅大樓(11層含以上有電梯),,鋼筋混凝土造,0721227,50.94,0,0,0,無,有,無,8500,167,,0.0,0,,RPWNMLLKRHIGFBE58CC,獨立套房,有,1120817~1130816,有,冷氣、熱水器、洗衣機、電視機、冰箱,一般代管
新興區,租賃房屋,高雄市新興區復興一路４７號６樓之４,0.0,,,,1120817,土地0建物1車位0,六層,12,住宅大樓(11層含以上有電梯),,鋼筋混凝土造,0771101,119.02,3,1,1,有,有,無,15000,126,,0.0,0,,RPXNMLLKRHIGFBE68CC,整棟(戶)出租,有,1120823~1130822,有,冷氣、熱水器、電視機、冰箱,一般代管
苓雅區,租賃房屋,高雄市苓雅區永平路５號２樓,0.0,住,,,1120831,土地1建物1車位0,二層,5,公寓(5樓含以下無電梯),,鋼筋混凝土造,0770611,77.78,2,2,1,有,無,有,9000,116,,0.0,0,,RPPOMLLKRHIGFBE97CC,整棟(戶)出租,無,1120905~1130904,無,冷氣、熱水器、洗衣機、電視機、冰箱,一般代管
前鎮區,租賃房屋+車位,高雄市前鎮區育群街９之１號二樓,0.0,,,,1120907,土地0建物1車位1,二層,15,住宅大樓(11層含以上有電梯),集合住宅,鋼筋混凝土,1091120,86.6,2,2,1,有,有,有,19000,219,坡道機械,11.15,0,續租案件；,RPPNMLLKRHIGFCE97CC,整棟(戶)出租,有,1120910~1130909,有,冷氣、熱水器、洗衣機、瓦斯或天然氣,社會住宅代管
小港區,租賃房屋,高雄市小港區水秀路７４巷２６之２號,0.0,,,,1120831,土地0建物1車位0,三層,4,公寓(5樓含以下無電梯),,鋼筋混凝土造,0681206,72.39,2,1,1,有,無,有,13500,186,,0.0,0,,RPQNMLLKRHIGFCE08CC,整棟(戶)出租,無,1120901~1130831,無,冷氣、熱水器、洗衣機、電視機、冰箱,社會住宅代管
小港區,租賃房屋,高雄市小港區平和九路３４之３號,0.0,,,,1120831,土地0建物1車位0,五層,5,公寓(5樓含以下無電梯),,鋼筋混凝土造,0710407,69.11,3,2,2,有,無,有,9000,130,,0.0,0,此為住宅及都市更新中心社會住宅包租代管計畫之物件租金總額含管理費；,RPRNMLLKRHIGFCE18CC,整棟(戶)出租,無,1120901~1130831,無,冷氣、熱水器、瓦斯或天然氣,社會住宅代管
小港區,租賃房屋,高雄市小港區達德街８３之４號,0.0,,,,1120831,土地0建物1車位0,五層,5,公寓(5樓含以下無電梯),,鋼筋混凝土造,0710311,67.38,3,1,2,有,無,有,10000,148,,0.0,0,住宅及都市更新中心社會住宅包租代管計畫之物件租金總額含管理費；,RPSNMLLKRHIGFCE28CC,整棟(戶)出租,無,1120901~1130831,無,冷氣、熱水器、洗衣機、電視機、冰箱,社會住宅代管
前鎮區,租賃房屋,高雄市前鎮區永豐路１７３號,0.0,,,,1120816,土地0建物1車位0,一層,15,店面(店鋪),店鋪、集合住宅,鋼筋混凝土造,1061211,261.55,0,0,0,無,有,無,60000,229,,0.0,0,,RPTNMLLKRHIGFCE38CC,,有,1120901~1130831,無,,
小港區,租賃房屋,高雄市小港區安和街３７號十樓,0.0,住,,,1120905,土地1建物1車位0,十層,12,住宅大樓(11層含以上有電梯),住家用,鋼筋混凝土造,0850911,145.45,3,2,2,有,有,無,12000,83,,0.0,0,,RPUNMLLKRHIGFCE48CC,整棟(戶)出租,有,1120905~1130904,有,冷氣、熱水器、洗衣機、電視機、冰箱、瓦斯或天然氣,一般代管
前鎮區,租賃房屋,高雄市前鎮區武德街８０號十二樓,0.0,,,,1120909,土地0建物1車位0,十二層,15,住宅大樓(11層含以上有電梯),集合住宅,鋼筋混凝土造,1050811,86.62,2,1,1,有,有,有,17000,196,,0.0,0,,RPVNMLLKRHIGFCE58CC,整棟(戶)出租,有,1120920~1130919,有,冷氣、熱水器、洗衣機、電視機、冰箱、瓦斯或天然氣,
前鎮區,租賃房屋+車位,高雄市前鎮區復興三路２８號十六樓之５,0.0,,,,1120903,土地0建物1車位1,十六層,29,住宅大樓(11層含以上有電梯),集合住宅,鋼筋混凝土,1071102,168.23000000000002,3,2,2,有,有,有,32000,190,坡道平面,26.32,0,租金總額含管理費；,RPWNMLLKRHIGFCE68CC,整棟(戶)出租,有,1120910~1130909,有,冷氣、熱水器、洗衣機、電視機、冰箱、瓦斯或天然氣,
前鎮區,租賃房屋,高雄市前鎮區崗山中街８２巷１８號,36.0,住,,,1120817,土地1建物1車位0,全,4,透天厝,住家用,鋼筋混凝土造,0830413,96.56,7,2,3,有,無,無,12000,124,,0.0,0,,RPXNMLLKRHIGFCE78CC,整棟(戶)出租,無,1120816~1130815,無,熱水器,
三民區,租賃房屋,高雄市三民區正興路１３２號,195.0,商,,,1120824,土地1建物1車位0,全,5,透天厝,店舖、住宅,鋼筋混凝土造,1050730,139.47,0,0,0,無,無,無,40000,287,,0.0,0,租金總額含稅；,RPPNMLLKRHIGFDE08CC,,無,1121001~1140930,無,,
三民區,租賃房屋,高雄市三民區鼎華路１８８號五樓之９,4.86,商,,,1120819,土地1建物1車位0,五層,11,住宅大樓(11層含以上有電梯),住家用,鋼筋混凝土造,0830105,50.78,1,1,1,有,有,無,9000,177,,0.0,0,,RPRNMLLKRHIGFDE28CC,獨立套房,無,1120822~1130821,有,冰箱,
楠梓區,租賃房屋,高雄市楠梓區大學二十六街２７巷１號八樓,0.0,,,,1120828,土地0建物1車位0,八層,15,住宅大樓(11層含以上有電梯),住家用,鋼筋混凝土,1030509,160.67000000000002,4,1,2,有,有,有,21770,135,,0.0,0,此為住宅及都市更新中心社會住宅包租代管計畫之物件。管理費2730元。,RPPNMLLKRHIGFEE18CC,整棟(戶)出租,有,1120901~1130831,有,冷氣、熱水器、洗衣機、冰箱、瓦斯或天然氣,社會住宅代管
左營區,租賃房屋,高雄市左營區民族一路１１６８號十二樓之１,0.0,,,,1120902,土地0建物1車位0,十二層,14,住宅大樓(11層含以上有電梯),住家用,鋼筋混凝土造,0870706,74.55,2,1,1,有,有,有,10000,134,,0.0,0,此為住宅及都市更新中心社會住宅包租代管計畫之物件。,RPQNMLLKRHIGFEE28CC,整棟(戶)出租,有,1120902~1130901,有,冷氣、熱水器、洗衣機、電視機、冰箱、瓦斯或天然氣,社會住宅代管
