苓雅區,租賃房屋,高雄市苓雅區中華四路５５號６樓之２,0.0,,,,1121022,土地0建物1車位0,六層,12,住宅大樓(11層含以上有電梯),,鋼筋混凝土造,0701215,48.49,1,1,1,有,有,有,12000,247,,0.0,0,,RPRNMLPLIIIGFBE77CC,整棟(戶)出租,有,1121022~1131021,有,熱水器、洗衣機、電視機、冰箱,
苓雅區,租賃房屋,高雄市苓雅區自強三路５號十八樓之３１,0.0,,,,1121016,土地0建物1車位0,十八層,85,住宅大樓(11層含以上有電梯),商業用,鋼骨鋼筋混凝土造,0880401,50.15,1,0,1,有,有,有,9000,179,,0.0,0,,RPSNMLPLIIIGFBE87CC,獨立套房,有,1121016~1131015,有,熱水器、電視機、冰箱,社會住宅代管
苓雅區,租賃房屋,高雄市苓雅區自強三路５號十七樓之１３,0.0,,,,1121016,土地0建物1車位0,十七層,85,住宅大樓(11層含以上有電梯),商業用,鋼骨鋼筋混凝土造,0880401,50.17,1,0,1,有,有,有,8500,169,,0.0,0,,RPTNMLPLIIIGFBE97CC,獨立套房,有,1121016~1131015,有,冷氣、熱水器、洗衣機、電視機、冰箱,社會住宅代管
新興區,租賃房屋,高雄市新興區六合一路２７號５樓之１,0.0,,,,1121017,土地0建物1車位0,五層,12,住宅大樓(11層含以上有電梯),,鋼筋混凝土造,0740524,134.14000000000001,3,2,2,有,有,有,13000,97,,0.0,0,此為國家住宅及都市更新中心社會住宅包租代管第4期計畫。,RPUNMLPLIIIGFBE08CC,整棟(戶)出租,有,1121021~1131020,有,熱水器、瓦斯或天然氣,社會住宅代管
苓雅區,租賃房屋,高雄市苓雅區忠孝二路１２７號,0.0,,,,1121025,土地0建物1車位0,全,4,透天厝,,鋼筋混凝土造,0650901,45.48,0,0,0,無,無,無,48000,1055,,0.0,0,,RPOOMLPLIIIGFBE57CC,,無,1121201~1141130,無,,
苓雅區,租賃房屋,高雄市苓雅區忠孝二路１２７號,0.0,,,,1121025,土地0建物1車位0,全,4,透天厝,,鋼筋混凝土造,0650901,45.48,0,0,0,無,無,無,48000,1055,,0.0,0,,RPPOMLPLIIIGFBE67CC,,無,1121201~1141130,無,,
前鎮區,建物,高雄市前鎮區三多二路４２５號十一樓,0.0,其他,,,1111119,土地0建物1車位0,十一層,14,住宅大樓(11層含以上有電梯),住家用,鋼筋混凝土造,0910205,111.51,3,2,2,有,有,有,16000,143,,0.0,0,,RPSNMLMKKIHGFCE67CC,,,,,,
前鎮區,租賃房屋,高雄市前鎮區鎮東一街１４５號,0.0,,,,1121011,土地0建物1車位0,全,3,透天厝,住商用,加強磚造,0570715,127.44,3,2,3,有,無,有,12000,94,,0.0,0,此為住宅及都市更新中心社會住宅包租代管計畫之物件,RPPNMLPLIIIGFCE67CC,整棟(戶)出租,無,1121014~1131013,無,冷氣、熱水器,社會住宅代管
小港區,租賃房屋,高雄市小港區鋼平街１７４巷７號九樓,0.0,,,,1121017,土地0建物1車位0,九層,10,華廈(10層含以下有電梯),集合住宅,鋼筋混凝土造,0830226,187.47,3,2,2,有,有,無,16000,85,,0.0,0,此為國家住宅及都市更新中心社會住宅包租代管第3期計畫。,RPQNMLPLIIIGFCE77CC,整棟(戶)出租,有,1121020~1130809,有,冷氣、熱水器、洗衣機、瓦斯或天然氣,社會住宅代管
前鎮區,租賃房屋,高雄市前鎮區凱旋四路２７２號十四樓,0.0,,,,1121019,土地0建物1車位0,十四層,14,住宅大樓(11層含以上有電梯),住家用,鋼筋混凝土造,0891023,98.68,3,1,2,有,有,有,18100,183,,0.0,0,此為國家住宅及都市更新中心社會住宅包租代管第3期計畫。,RPRNMLPLIIIGFCE87CC,整棟(戶)出租,有,1121024~1131023,有,冷氣、熱水器、洗衣機、電視機、冰箱、瓦斯或天然氣,社會住宅代管
前鎮區,租賃房屋,高雄市前鎮區一心二路２０６號２０樓之８,0.0,,,,1121023,土地0建物1車位0,見其他登記事項,20,住宅大樓(11層含以上有電梯),住家用,鋼筋混凝土造,0831001,71.65,1,1,1,有,有,有,15000,209,,0.0,0,,RPSNMLPLIIIGFCE97CC,整棟(戶)出租,有,1121023~1131022,有,冷氣、熱水器、洗衣機、電視機、冰箱,社會住宅代管
前鎮區,租賃房屋+車位,高雄市前鎮區中華五路１４３１號３樓之２,14.17,商,,,1121016,土地1建物1車位1,三層,15,住宅大樓(11層含以上有電梯),住家用,鋼筋混凝土造,0950314,146.82999999999998,3,2,2,有,有,有,26000,177,坡道平面,24.18,0,租金總額含管理費；續租案件；,RPTNMLPLIIIGFCE08CC,整棟(戶)出租,有,1121020~1121119,有,冷氣、熱水器、洗衣機、電視機、冰箱、瓦斯或天然氣,
前鎮區,租賃房屋,高雄市前鎮區一心二路２０６號三樓之１０,0.0,,,,1121017,土地0建物1車位0,三層,20,住宅大樓(11層含以上有電梯),住家用,鋼筋混凝土造,0831001,36.56,1,0,1,有,有,有,9000,246,,0.0,0,管理費700元,RPUNMLPLIIIGFCE18CC,獨立套房,有,1121105~1151104,有,冷氣、熱水器、洗衣機、冰箱,社會住宅包租轉租
前鎮區,租賃房屋,高雄市前鎮區瑞崗二街１８號,56.0,住,,,1121015,土地1建物1車位0,全,2,透天厝,住家用,加強磚造,0600830,82.66,2,3,3,有,無,無,18000,218,,0.0,0,含增建或未登記建物；,RPVNMLPLIIIGFCE28CC,整棟(戶)出租,無,1121025~1131024,無,冷氣、熱水器,
前鎮區,租賃房屋,高雄市前鎮區凱旋三路２６５之３號,0.0,,,,1121016,土地0建物1車位0,四層,5,公寓(5樓含以下無電梯),,鋼筋混凝土造,0690424,60.18,3,1,1,有,無,有,8000,133,,0.0,0,此為國家住宅及都市更新中心社會住宅包租代管第4期計畫。,RPXNMLPLIIIGFCE48CC,整棟(戶)出租,無,1121023~1131022,無,熱水器,社會住宅代管
前鎮區,租賃房屋,高雄市前鎮區管仲路５０巷４４弄５號,0.0,,,,1121013,土地0建物1車位0,全,3,透天厝,,鋼筋混凝土造,0760520,179.97,4,2,3,有,無,有,20000,111,,0.0,0,此為國家住宅及都市更新中心社會住宅包租代管計畫之物件。,RPOOMLPLIIIGFCE67CC,整棟(戶)出租,無,1121015~1131014,無,冷氣、熱水器、瓦斯或天然氣,社會住宅代管
前鎮區,租賃房屋,高雄市前鎮區英明路１９號,105.39,住,,,1121015,土地1建物1車位0,一層,15,店面(店鋪),店舖、集合住宅,鋼筋混凝土,1100806,141.15,0,0,0,無,有,無,19900,141,,0.0,0,,RPTOMLPLIIIGFCE18CC,,有,1121015~1181014,有,,
三民區,租賃房屋,高雄市三民區延吉街８７巷８之３號,0.0,,,,1121011,土地0建物1車位0,四層,5,公寓(5樓含以下無電梯),,鋼筋混凝土造,0690523,118.44,3,2,2,有,無,無,10000,84,,0.0,0,此為住宅及都市更新中心社會住宅包租代管計畫之物件,RPPNMLPLIIIGFDE77CC,整棟(戶)出租,無,1121023~1131022,無,冷氣、熱水器、瓦斯或天然氣,社會住宅代管
三民區,租賃房屋,高雄市三民區九如二路５７號８樓之６,0.0,,,,1121017,土地0建物1車位0,八層,13,住宅大樓(11層含以上有電梯),,鋼筋混凝土造,0691223,108.0,2,2,2,有,有,有,9500,88,,0.0,0,,RPQNMLPLIIIGFDE87CC,整棟(戶)出租,有,1121101~1131031,有,冷氣、熱水器、洗衣機、冰箱、瓦斯或天然氣,
三民區,租賃房屋,高雄市三民區鐵新二街１１０號,0.0,,,,1121004,土地0建物1車位0,全,3,透天厝,,鋼筋混凝土造,0641215,16.52,3,1,2,有,無,有,7500,454,,0.0,0,高雄市三民區鐵新二街108、110、112、116號，四個門牌為打通的格局,RPSNMLPLIIIGFDE08CC,,無,1121004~1130930,無,冷氣、網路,
三民區,租賃房屋,高雄市三民區鼎山街５７５號９樓之２,0.0,,,,1121017,土地0建物1車位0,九層,15,住宅大樓(11層含以上有電梯),住家用,鋼筋混凝土造,0990115,128.15,3,2,2,有,有,有,23000,179,,0.0,0,此為國家住宅及都市更新中心社會住宅包租代管第3期計畫。,RPTNMLPLIIIGFDE18CC,整棟(戶)出租,有,1121025~1131024,有,冷氣、熱水器、洗衣機、電視機、冰箱、瓦斯或天然氣,社會住宅代管
三民區,租賃房屋,高雄市三民區建國三路４３７號３樓之１,0.0,,,,1121020,土地0建物0車位0,三層,12,住宅大樓(11層含以上有電梯),商業用,鋼筋混凝土造,0820227,23.14,18,0,18,有,有,有,9300,402,,0.0,0,,RPUNMLPLIIIGFDE28CC,分租套房,有,1121020~1131031,有,冷氣、熱水器、電視機、冰箱、有線電視、網路,一般代管
三民區,租賃房屋,高雄市三民區褒揚東街９６號,352.6,住,,,1121018,土地1建物1車位0,全,5,透天厝,住商用,鋼筋混凝土造,1010813,356.2,0,0,0,無,無,無,290597,816,,0.0,0,租金總額含稅；租賃期間有約定不同租金承租首月租金優待半價112/10/20?112/11/19租金：145298元承租次月開始至合約期限結束，租金為申報租金112/11/20?114/10/19租金：290597元；,RPVNMLPLIIIGFDE38CC,,無,1121020~1141019,有,,
三民區,租賃房屋,高雄市三民區大昌二路２６８號十樓之１０,0.0,,,,1121013,土地0建物1車位0,十層,14,住宅大樓(11層含以上有電梯),住家用,鋼筋混凝土造,0880731,44.589999999999996,1,1,1,有,有,有,8300,186,,0.0,0,此為國家住宅及都市更新中心社會住宅包租代管第3期計畫。管理費700元,RPWNMLPLIIIGFDE48CC,獨立套房,有,1121015~1131014,有,冷氣、熱水器、洗衣機、電視機、冰箱,社會住宅代管
三民區,租賃房屋,高雄市三民區九如一路５６５巷１號４樓之３,0.0,,,,1121019,土地0建物1車位0,四層,23,住宅大樓(11層含以上有電梯),住家用,鋼筋混凝土造,0831114,145.3,3,2,2,有,有,有,22000,151,,0.0,0,租金總額含管理費；續租案件；,RPXNMLPLIIIGFDE58CC,整棟(戶)出租,有,1121120~1141119,有,冷氣、熱水器、洗衣機、冰箱、瓦斯或天然氣,
三民區,租賃房屋,高雄市三民區愛國路９９號九樓之２１,0.0,,,,1121016,土地0建物1車位0,九層,10,華廈(10層含以下有電梯),商業用,鋼筋混凝土造,0950726,16.34,1,0,1,有,有,有,5000,306,,0.0,0,,RPOOMLPLIIIGFDE77CC,獨立套房,有,1121020~1131019,有,冷氣、熱水器、冰箱,社會住宅代管
三民區,租賃房屋,高雄市三民區建興路８１之１號十一樓,0.0,,,,1121003,土地0建物1車位0,十一層,14,住宅大樓(11層含以上有電梯),住家用,鋼筋混凝土造,1010611,78.34,2,1,1,有,有,有,12000,153,,0.0,0,此為國家住宅及都市更新中心社會住宅包租代管計畫之物件，管理費2000元。,RPPOMLPLIIIGFDE87CC,整棟(戶)出租,有,1121015~1131014,有,冷氣、熱水器、洗衣機、電視機、冰箱、瓦斯或天然氣,社會住宅代管
三民區,租賃房屋+車位,高雄市三民區十全三路６號１６樓之１５,12.84,住,,,1120927,土地2建物1車位1,十六層,22,住宅大樓(11層含以上有電梯),集合住宅,鋼筋混凝土,1100726,143.78,3,2,2,有,有,有,28000,195,坡道平面,0.0,0,,RPQOMLPLIIIGFDE97CC,整棟(戶)出租,有,1121015~1141014,有,冷氣、熱水器、洗衣機、電視機、冰箱、瓦斯或天然氣,
三民區,租賃房屋,高雄市三民區大連街３８,69.0,住,,,1121002,土地1建物1車位0,全,3,透天厝,,加強磚造,0631224,169.8,3,2,3,有,無,無,26000,153,,0.0,0,,RPSOMLPLIIIGFDE18CC,整棟(戶)出租,無,1121002~1131001,無,熱水器,一般轉租
三民區,租賃房屋,高雄市三民區應安街９６號１３樓,19.7,商,,,1121011,土地1建物1車位0,十三層,13,住宅大樓(11層含以上有電梯),住家用,鋼筋混凝土造,0960129,155.36,4,2,2,有,有,有,28000,180,,0.0,0,未租賃車位，建物登記含有車位面積；,RPTOMLPLIIIGFDE28CC,整棟(戶)出租,有,1121101~1130430,有,冷氣、熱水器、電視機、瓦斯或天然氣,
楠梓區,租賃房屋,高雄市楠梓區德賢路５６９之１號四樓,0.0,,,,1121005,土地0建物1車位0,四層,15,住宅大樓(11層含以上有電梯),住家用,鋼筋混凝土造,1000913,78.11,2,1,1,有,有,有,12000,154,,0.0,0,此為住宅及都市更新中心社會住宅包租代管計畫之物件,RPPNMLPLIIIGFEE87CC,整棟(戶)出租,有,1121005~1131004,有,冷氣、熱水器、洗衣機、冰箱、瓦斯或天然氣,社會住宅代管
左營區,租賃房屋,高雄市左營區新莊一路２０１號六樓之３,0.0,,,,1121012,土地0建物1車位0,六層,14,住宅大樓(11層含以上有電梯),住家用,鋼筋混凝土造,0940520,86.63,2,1,1,有,有,有,14000,162,,0.0,0,此為住宅及都市更新中心社會住宅包租代管計畫之物件,RPQNMLPLIIIGFEE97CC,整棟(戶)出租,有,1121015~1130825,有,冷氣、熱水器、洗衣機、電視機、冰箱、瓦斯或天然氣,社會住宅包租轉租
楠梓區,租賃房屋,高雄市楠梓區朝明路１３０巷５號５樓之５,21.44,住,,,1121007,土地3建物1車位0,五層,7,華廈(10層含以下有電梯),住家用,鋼筋混凝土造,0820208,113.69,4,2,2,有,有,有,14000,123,,0.0,0,多人共同承租2；,RPRNMLPLIIIGFEE08CC,整棟(戶)出租,有,1121007~1131006,有,冷氣、熱水器、洗衣機、冰箱、瓦斯或天然氣,一般包租
楠梓區,租賃房屋,高雄市楠梓區土庫二路３０號四樓,20.42,住,,,1121024,土地1建物1車位0,四層,23,住宅大樓(11層含以上有電梯),集合住宅,鋼筋混凝土,1040216,107.28,2,1,2,有,有,有,16000,149,,0.0,0,租金總額含管理費；,RPSNMLPLIIIGFEE18CC,整棟(戶)出租,有,1121024~1131023,有,冷氣、熱水器、洗衣機、電視機、冰箱、瓦斯或天然氣,一般包租
楠梓區,租賃房屋,高雄市楠梓區和光街１６３巷２２號,0.0,,,,1121016,土地0建物1車位0,全,2,透天厝,,加強磚造,0600210,71.88,2,1,2,有,無,無,15000,209,,0.0,0,此為國家住宅及都市更新中心社會住宅包租代管第3期計畫。,RPUNMLPLIIIGFEE38CC,整棟(戶)出租,無,1121030~1131029,無,冷氣、熱水器、洗衣機、冰箱、瓦斯或天然氣,社會住宅代管
左營區,租賃房屋,高雄市左營區南屏路８６號５樓,0.0,,,,1121022,土地0建物1車位0,五層,5,公寓(5樓含以下無電梯),,鋼筋混凝土造,0750529,105.84,3,1,2,有,無,有,8500,80,,0.0,0,,RPVNMLPLIIIGFEE48CC,整棟(戶)出租,無,1121006~1131005,無,熱水器、冰箱,社會住宅代管
左營區,租賃房屋,高雄市左營區博愛四路１６０號七樓之２,0.0,,,,1121018,土地0建物1車位0,七層,15,住宅大樓(11層含以上有電梯),住家用,鋼筋混凝土造,0951124,81.8,2,1,1,有,有,有,12890,158,,0.0,0,此為國家住宅及都市更新中心社會住宅包租代管第3期計畫。管理費1110元。,RPWNMLPLIIIGFEE58CC,整棟(戶)出租,有,1121020~1131019,有,冷氣、熱水器、洗衣機、電視機、冰箱、瓦斯或天然氣,社會住宅包租轉租
左營區,租賃房屋,高雄市左營區文慈路２８９巷３７號三樓,0.0,,,,1121018,土地0建物1車位0,三層,8,華廈(10層含以下有電梯),住家用,鋼筋混凝土造,0830502,94.41,3,2,2,有,有,有,10000,106,,0.0,0,此為國家住宅及都市更新中心社會住宅包租代管第3期計畫。,RPOOMLPLIIIGFEE87CC,整棟(戶)出租,無,1121027~1131026,有,冷氣、熱水器、洗衣機、電視機、冰箱、瓦斯或天然氣,社會住宅代管
左營區,租賃房屋,高雄市左營區新莊一路２０１號二樓之１,0.0,,,,1121023,土地0建物1車位0,二層,14,住宅大樓(11層含以上有電梯),住家用,鋼筋混凝土造,0940520,81.78,2,1,1,有,有,有,19000,232,,0.0,0,租金總額含管理費；,RPPOMLPLIIIGFEE97CC,整棟(戶)出租,有,1121101~1131031,有,冷氣、熱水器、洗衣機、電視機、冰箱、瓦斯或天然氣,
楠梓區,租賃房屋,高雄市楠梓區樂群路１９１巷１２之３號,0.0,,,,1121016,土地0建物1車位0,三層,4,公寓(5樓含以下無電梯),,鋼筋混凝土造,0680606,83.09,3,2,1,有,無,有,9800,118,,0.0,0,此為國家住宅及都市更新中心社會住宅包租代管第4期計畫。,RPQOMLPLIIIGFEE08CC,整棟(戶)出租,無,1121030~1131029,無,冷氣、熱水器、洗衣機、電視機、瓦斯或天然氣,社會住宅代管
左營區,租賃房屋+車位,高雄市左營區崇德路５８號六樓,6.94,商,,,1121015,土地1建物1車位1,六層,15,住宅大樓(11層含以上有電梯),住家用,鋼筋混凝土造,0970103,89.96000000000001,2,2,1,有,有,有,18475,205,坡道機械,9.89,0,管理費2025元。,RPROMLPLIIIGFEE18CC,整棟(戶)出租,有,1121101~1141031,有,冷氣、熱水器、洗衣機、電視機、冰箱、瓦斯或天然氣,
左營區,租賃房屋,高雄市左營區榮德街４３３號十一樓之２,8.0,住,,,1121012,土地1建物1車位0,十一層,14,住宅大樓(11層含以上有電梯),住家用,鋼筋混凝土造,0960808,78.86,2,1,1,有,有,有,20050,254,,0.0,0,租金總額含管理費；,RPSOMLPLIIIGFEE28CC,整棟(戶)出租,有,1121019~1131018,有,冷氣、熱水器、洗衣機、電視機、瓦斯或天然氣,
左營區,租賃房屋+車位,高雄市左營區文學路１６３號二樓,0.0,,,,1121018,土地0建物1車位1,二層,15,住宅大樓(11層含以上有電梯),集合住宅,鋼筋混凝土,1120322,150.42000000000002,3,2,2,有,有,有,50000,332,坡道平面,29.28,0,租金總額含管理費；,RPTOMLPLIIIGFEE38CC,整棟(戶)出租,有,1121018~1131031,有,冷氣、熱水器、洗衣機、電視機、冰箱,
楠梓區,租賃房屋,高雄市楠梓區大學二十六街２７巷２１號六樓,0.0,,,,1121006,土地0建物1車位0,六層,15,住宅大樓(11層含以上有電梯),住家用,鋼筋混凝土,1030509,84.53999999999999,2,2,1,有,有,無,9721,115,,0.0,0,此為國家住宅及都市更新中心社會住宅包租代管計畫。管理費1279元,RPUOMLPLIIIGFEE48CC,整棟(戶)出租,有,1121010~1130730,有,冷氣、熱水器、瓦斯或天然氣,社會住宅包租轉租
橋頭區,租賃房屋,高雄市橋頭區仕豐路２９-１號,18.0,住,,,1121024,土地1建物1車位0,全,4,透天厝,住商用,鋼筋混凝土造,0951205,32.03,1,0,1,有,無,有,7500,234,,0.0,0,租金總額含水費；網路費；,RPRNMLPLIIIGFFE18CC,獨立套房,無,1121024~1131023,無,冷氣、熱水器、洗衣機、電視機、冰箱,
岡山區,土地,台安段295地號,528.93,,一般農業區,農牧用地,1121023,土地1建物0車位0,,,其他,,,,0.0,0,0,0,無,無,無,33000,62,,0.0,0,承租部分土地約160坪，承租未保存登記建物約53坪含增建或未登記建物；,RPSNMLPLIIIGFFE28CC,,,1121104~1141103,,,
橋頭區,租賃房屋,高雄市橋頭區中正路４８巷１８弄４號,0.0,,,,1121006,土地0建物1車位0,全,2,透天厝,住家用,加強磚造,0690917,85.94,3,2,2,有,無,無,17000,198,,0.0,0,此為國家住宅及都市更新中心社會住宅包租代管計畫。,RPUNMLPLIIIGFFE48CC,整棟(戶)出租,無,1121009~1131008,無,冷氣、熱水器、洗衣機、電視機、冰箱、瓦斯或天然氣,社會住宅代管
鳳山區,房地(土地+建物),高雄市鳳山區五甲一路３３２巷１８之３號,27.0,住,,,1111121,土地1建物1車位0,四層,5,公寓(5樓含以下無電梯),住家用,鋼筋混凝土造,0691127,73.53,3,2,1,有,有,有,8000,109,,0.0,0,此案件已在112/10/18向受理縣市:高雄市鳳山地政事務所申報更正因租賃合約書標的物現況確認書專員勾選有管理組織實價登錄記載則無管理組織故特此修改正確內容,RPUNMLMLJIHGFGE28CC,,,,,,
鳳山區,房地(土地+建物),高雄市鳳山區國昌路１０巷５之２號,27.0,住,,,1120110,土地1建物1車位0,三層,5,公寓(5樓含以下無電梯),住家用,鋼筋混凝土造,0691222,73.53,4,2,2,有,有,無,12000,163,,0.0,0,此案件已在112/10/18向受理縣市:高雄市鳳山地政事務所申報更正因租賃合約書標的物現況確認書專員勾選有管理組織實價登錄記載則無管理組織故特此修改正確內容,RPVNMLNKJHIGFGE38CC,,,,,,
鳳山區,租賃房屋+車位,高雄市鳳山區光遠路１１號１４樓,15.42,住,,,1121024,土地1建物1車位1,十四層,14,住宅大樓(11層含以上有電梯),集合住宅,鋼筋混凝土,1110127,115.75,2,2,1,有,有,有,19876,172,坡道平面,33.17,0,,RPQNMLPLIIIGFGE18CC,整棟(戶)出租,有,1121101~1131031,有,冷氣、熱水器、洗衣機、冰箱、瓦斯或天然氣,一般包租
鳳山區,租賃房屋,高雄市鳳山區自強二路１９０巷２０之２號,0.0,,,,1121017,土地0建物1車位0,三層,5,公寓(5樓含以下無電梯),住家用,鋼筋混凝土造,0720314,68.92,3,2,1,有,無,有,8000,116,,0.0,0,此為國家住宅及都市更新中心社會住宅包租代管第3期計畫。,RPRNMLPLIIIGFGE28CC,整棟(戶)出租,無,1121101~1131031,無,冷氣、熱水器,社會住宅代管
鳳山區,租賃房屋+車位,高雄市鳳山區文興街２之５號３樓之７,0.0,,,,1121020,土地0建物1車位1,三層,7,華廈(10層含以下有電梯),集合住宅,鋼筋混凝土,1111205,57.85,1,0,1,有,有,有,13500,233,坡道平面,0.0,0,,RPSNMLPLIIIGFGE38CC,獨立套房,有,1121028~1131031,有,冷氣、熱水器、洗衣機、電視機、冰箱、有線電視、網路,一般代管
鳳山區,租賃房屋,高雄市鳳山區仁愛路２號,0.0,,,,1121024,土地0建物1車位0,全,2,透天厝,店舖、住宅,加強磚造,0571029,65.58,0,0,0,無,無,無,50000,762,,0.0,0,,RPUNMLPLIIIGFGE58CC,,無,1121201~1141130,無,,
鳳山區,租賃房屋,高雄市鳳山區南福街１５２巷１０號八樓,0.0,,,,1121017,土地0建物1車位0,八層,10,華廈(10層含以下有電梯),住家用,鋼筋混凝土造,0820428,131.59,4,1,2,有,有,無,15000,114,,0.0,0,租金總額含管理費；續租案件；,RPVNMLPLIIIGFGE68CC,整棟(戶)出租,有,1121009~1131008,有,熱水器,社會住宅包租轉租
仁武區,土地,仁新段947-1地號,759.0,其他,,,1121003,土地2建物0車位0,,,其他,,,,0.0,0,0,0,無,無,無,70000,92,,0.0,0,承租未保存登記建物約215坪含增建或未登記建物；租賃期間有約定不同租金第4年開始租金調整為新台?72000元整；,RPPNMLPLIIIGFIE28CC,,,1121201~1171130,,,
湖內區,租賃房屋,高雄市湖內區長春一街８５號,0.0,,,,1120926,土地0建物0車位0,四層,5,公寓(5樓含以下無電梯),住商用,鋼筋混凝土造,0950830,21.01,8,0,8,有,無,有,6600,314,,0.0,0,租金總額含水費；網路費；其他第四台；,RPQNMLPLIIIGFJE48CC,分租套房,無,1121001~1121231,無,冷氣、洗衣機、電視機、冰箱、有線電視、網路,一般轉租
湖內區,租賃房屋,高雄市湖內區長春一街８７號,0.0,,,,1120926,土地0建物0車位0,全,5,透天厝,住商用,鋼筋混凝土造,0950830,21.01,8,0,8,有,無,有,6600,314,,0.0,0,租金總額含水費；網路費；其他第四台；,RPRNMLPLIIIGFJE58CC,分租套房,無,1121001~1121231,無,冷氣、洗衣機、電視機、冰箱、有線電視、網路,一般轉租
湖內區,租賃房屋,高雄市湖內區長春一街８１號,0.0,,,,1120926,土地0建物0車位0,全,5,透天厝,住商用,鋼筋混凝土造,0950830,21.01,8,0,8,有,無,有,6600,314,,0.0,0,租金總額含水費；網路費；其他第四台；,RPTNMLPLIIIGFJE78CC,分租套房,無,1121001~1121231,無,冷氣、洗衣機、電視機、冰箱、有線電視、網路,一般轉租
湖內區,租賃房屋,高雄市湖內區長壽路９８號,0.0,,,,1120926,土地0建物0車位0,全,5,透天厝,住商用,鋼筋混凝土造,0950830,20.58,8,0,8,有,無,有,6600,321,,0.0,0,租金總額含水費；網路費；其他第四台；,RPUNMLPLIIIGFJE88CC,分租套房,無,1121001~1121231,無,冷氣、洗衣機、電視機、冰箱、有線電視、網路,一般轉租
林園區,租賃房屋,高雄市林園區五福路２５２巷１２８弄２０號,0.0,,,,1121012,土地0建物1車位0,全,4,透天厝,集合住宅,鋼筋混凝土造,1120324,178.01,4,2,2,有,無,無,26000,146,,0.0,0,此為住宅及都市更新中心社會住宅包租代管計畫之物件,RPPNMLPLIIIGFLE58CC,整棟(戶)出租,無,1121015~1131014,無,熱水器、瓦斯或天然氣,社會住宅代管
大寮區,租賃房屋,高雄市大寮區九和路１巷１１之３號,0.0,,,,1121004,土地0建物1車位0,四層,5,公寓(5樓含以下無電梯),住家用,鋼筋混凝土造,0701210,65.28,3,2,2,有,無,有,7000,107,,0.0,0,此為國家住宅及都市更新中心社會住宅包租代管計畫之物件。,RPRNMLPLIIIGFLE78CC,整棟(戶)出租,無,1121026~1131025,無,冷氣、熱水器、洗衣機、電視機、冰箱、瓦斯或天然氣,社會住宅代管
前金區,租賃房屋,高雄市前金區光明街２號４樓之８,6.48,商,,,1121022,土地1建物1車位0,四層,15,住宅大樓(11層含以上有電梯),集合住宅,鋼筋混凝土,1080715,90.94,3,2,1,有,有,有,25000,275,,0.0,0,租金總額含管理費；,RPPNMLQLIIIGFAE57CC,整棟(戶)出租,有,1121108~1131107,有,冷氣、熱水器、洗衣機、電視機、冰箱、瓦斯或天然氣,
鼓山區,租賃房屋+車位,高雄市鼓山區文信路２４８號十四樓之１,0.0,,,,1121021,土地0建物1車位1,十四層,15,住宅大樓(11層含以上有電梯),住家用,鋼筋混凝土造,1020604,145.49,3,2,2,有,有,有,33000,227,坡道平面,19.34,0,多人共同承租2；租金總額含管理費；,RPQNMLQLIIIGFAE67CC,整棟(戶)出租,有,1121101~1141031,有,冷氣、熱水器、洗衣機、電視機、冰箱、瓦斯或天然氣,
鼓山區,租賃房屋+車位,高雄市鼓山區昌盛路１２號１０樓之１,7.4,商,,,1121022,土地1建物1車位1,十層,14,住宅大樓(11層含以上有電梯),住家用,鋼筋混凝土造,0880930,76.4,2,2,1,有,無,有,15000,196,坡道機械,7.04,0,,RPRNMLQLIIIGFAE77CC,分層出租,有,1121101~1131031,有,冷氣、熱水器、洗衣機、電視機、冰箱、瓦斯或天然氣,一般包租
鼓山區,租賃房屋,高雄市鼓山區裕誠路１５９９號十三樓,0.0,,,,1121017,土地0建物1車位0,十三層,15,住宅大樓(11層含以上有電梯),住家用,鋼筋混凝土造,0840126,126.72999999999999,4,2,2,有,有,無,18000,142,,0.0,0,,RPSNMLQLIIIGFAE87CC,整棟(戶)出租,有,1121025~1131024,有,冷氣、熱水器、瓦斯或天然氣,一般代管
鼓山區,租賃房屋,高雄市鼓山區明倫路５１４巷２１號五樓之１,0.0,,,,1121013,土地0建物1車位0,五層,9,華廈(10層含以下有電梯),住家用,鋼筋混凝土造,0940322,85.03999999999999,2,1,1,有,有,無,15000,176,,0.0,0,,RPTNMLQLIIIGFAE97CC,整棟(戶)出租,有,1121015~1131014,有,冷氣、熱水器、洗衣機、冰箱,一般代管
